B2,Combined_Text,Framing,Priming,Repetition,Narrative/Story,Reciprocity,Commitment and Consistency,Social Proof,Scarcity,Authority,Liking,Argument Type,Hedging and Politeness,Pronoun Use,Active Tense,Concreteness,Linguistic Fluency,Linguistic Mirroring,Credibility Markers,Certainty Markers,Rhetorical Questions
20180826-175705_624_live,"Persuader: hello, do you know about the charity save the children?
Persuadee: Hi.
Persuadee: No, I have not heard about that charity.
Persuader: do you want some info?
Persuadee: Yes, I would love some information.
Persuader: save the children is a non-profit organization that help the children all around the world.
Persuadee: How do they help the children?
Persuader: they collect charities and help the children by schooling them , feeding them, curing them.
Persuadee: That sounds great.
Persuadee: How can I get involved?
Persuader: you can help by being part of us, do you want to help?
Persuadee: I would really like to help.
Persuader: cool, you just have to agree to give some amount of your bonus, you can give how much you want.
Persuader: are you interested?
Persuadee: Yes, I'm interested.
Persuadee: I can give $0.60 cents.
Persuader: cool, you are a very kind person, you know that you can help a child being feed today?
Persuadee: Really?
Persuadee: Does the charity feed the children in the USA or abroad?
Persuader: they feed the children where is a child in difficulties , they now are helpin Hawaii with the hurricane
Persuadee: That is amazing.
Persuadee: Is there any other way to get involved besides donating?
Persuader: for the moment donating is good, but if you really are interested you can apply for a job in our organization.
Persuadee: Okay, I will think about it.
Persuadee: What do you do in the organization?
Persuader: i help with everything they say to me, now im helping finding people donating, thank you for the donation today, god bless you.
Persuadee: Thank you very much.
Persuadee: I will happily donate 60 cents.",Yes,No,No,No,Yes,Yes,No,No,No,Yes,Emotional,Yes,Yes,Yes,Concrete,Yes,Yes,No,No,Yes
20180826-175706_443_live,"Persuader: Have you ever heard of Save the Children?
Persuadee: I have not.
Persuadee: What can you tell me about it?
Persuader: It is an international non-governmental organisation.
Persuader: It promotes children's rights
Persuadee: That sounds interesting.
Persuadee: I am all for helping children in any way possible.
Persuader: Would you be interested in donating to this charity?
Persuadee: I would want to do some research first but that would be a possibility.
Persuadee: I like to learn as much as I can about an organization before donating.
Persuader: Kids are dying from hunger every minute.
Persuader: Don't you want to help stop that?
Persuadee: Of course I do.
Persuadee: I also want to make sure my donations are not going into the pockets of money hungry CEO's.
Persuadee: How do you feel about that?
Persuader: I understand, but I can assure you that is goes directly to the kids.
Persuadee: How can you assure me?
Persuadee: Do you work for them?
Persuader: I do not, but they are a very professional organization.
Persuader: It is an international company.
Persuadee: Save the Children International's CEO Helle Thorning-Schmidt earned $299,136 in 2017.
Persuadee: Simple Google search.
Persuader: That isn't a lot for a CEO.
Persuadee: No its not.
Persuadee: However, that is only salary.
Persuadee: It doesnt include extras that all CEO's receive.
Persuader: There isn't a lot of support for children in developing countries.
Persuader: This should make you mad and want to help.
Persuadee: Have you personally donated?
Persuader: Yes, why don't you join me?
Persuadee: That is impossible at this time.
Persuadee: I just do not have the funds available.
Persuader: How much do you like to donate to the charity now?
Persuader: Your donation will be directly deducted from your task payment.
Persuader: You can choose any amount from $0 to all your payment.""
Persuadee: I chose to donate $0.",Yes,No,No,No,No,No,No,No,Yes,Yes,Emotional,No,Yes,Yes,Concrete,Yes,No,Yes,No,Yes
20180826-175853_545_live,"Persuader: do you know Save the children?
Persuadee: No, I am not very familiar with that charity.
Persuader: Its very important.
Persuader: Provide health assistant for kids in need
Persuadee: It sounds like a meaningful charity.
Persuader: It is.
Persuader: Every child must have health care and food to put in their bellies
Persuadee: Is it world wide.
Persuader: Yes they are everywhere.
Persuader: I saw a kid die in my hands once.
Persuader: It was horrible
Persuadee: Wow, that is intense.
Persuader: THanks to Save the children.
Persuader: The number of death worlwide has been reduced
Persuadee: That is incredible, glad to here this charity exists.
Persuader: HAve much money do you waste on candy on a monthly basis?
Persuadee: I don't eat candy.
Persuader: I am sure that you should be spending money in something you dont really need
Persuadee: I am on a very tight budget.
Persuader: Can you donate something to the children today?
Persuadee: I can donate .10 of my mturk earnings.
Persuader: Thats great news!!!.Children will be grateful
Persuadee: That sounds great!
Persuader: The organization will make good use of your money
Persuadee: I am so glad to hear that!",Yes,No,Yes,Yes,No,No,Yes,No,No,Yes,Emotional,Yes,No,Yes,Concrete,Yes,Yes,Yes,No,No
20180826-180009_407_live,"Persuader: Hi!
Persuader: Have you heard of an organization called Save the Children?
Persuadee: I think I have once before, in a grocery store I believe
Persuader: Do you mind if i give you a little information about them?
Persuadee: Sure, go ahead
Persuader: Just some ver basic info, Save the Children is an international non-governmental organization that promotes children's rights, provides relief and helps support children in developing countries.
Persuadee: Are they a non profit organization?
Persuader: Yes they are!
Persuader: They work 100% on donated funds.
Persuader: There is  a lack of support for children in developing countries, especially in war zones.
Persuader: For instance, millions of Syrian children have grown up facing the daily threat of violence.
Persuader: In the first two months of 2018 alone, 1,000 children were reportedly killed or injured in intensifying violence.
Persuader: Your donation can address such problems.
Persuadee: Oh wow, shocking news.
Persuadee: Do you know how many children have been helped due to this organization?
Persuader: According t0 their yearend report they were able to reach 155 million children.
Persuader: Over 200k of those kids were in the US.
Persuadee: Thats awesome!
Persuadee: Are you apart of this organization or just support them?
Persuader: I am just a supporter but I would like to ask how much do you like to donate to the charity?
Persuader: Your donation will be directly deducted from your task payment.
Persuader: You can choose any amount from $0 to all your payment
Persuadee: The payment of the task is 30 cents, I would donate 10c
Persuader: That is awesome!
Persuader: Thank you so much! What are you hoping your donation will help with?
Persuadee: its not a lot but hopefully go towards someone else donation to help children in war zone areas
Persuader: I am so grateful for your donation.
Persuader: It means alot to this rganization.
Persuadee: Of course, its a great organization to support
Persuader: Have you donated to a similar charity?
Persuadee: Yes, a few times before
Persuader: Again, I really appreciate it and hope you have a great evening!
Persuadee: Thank you, you too!",Yes,No,No,Yes,No,Yes,Yes,No,No,Yes,Emotional,Yes,Yes,Yes,Concrete,Yes,Yes,Yes,No,Yes
20180826-180300_663_live,"Persuader: Good afternoon/evening
Persuadee: Hello
Persuader: Looks like there might be a bonus coming at the end of this HIT, have you got any plans for the money?
Persuadee: Nope, what do you recommend?
Persuader: I read a lot about the Save the Children charity before I came in here.
Persuader: I hope that more people will donate a portion of their income.
Persuader: Even small amounts will definitely help
Persuadee: What's Save the Children all about?
Persuader: They provide relief and support to children in developing nations, especially the millions of kids who are at risk in Syria.
Persuader: They are a charity we can trust, so I think we all should do our part to help the less fortunate
Persuadee: Do they provide for the millions of hungry kids here in the USA?
Persuader: They concentrate on developing countries, but, personally, I think that there is just as great a need abroad as there is at home
Persuadee: Yeah, i think an American charity should focus on America too
Persuader: That's true, but we're all in this together, as they say.
Persuader: People far away need help just as much as people close to us.
Persuader: You could even take the money that you want to give to charity and split it in half among American and international relief agencies
Persuadee: That would work best for me.
Persuadee: That way i know where my money is going.
Persuadee: Is there a minimum to donate?
Persuader: No, there is no minimum that I've ever heard of.
Persuader: They know that any small amount can help.
Persuadee: That's great!
Persuadee: Is there a website where i can donate?
Persuader: I'm glad to hear it!
Persuader: Save the Children do have a website at  URL
Persuader: You can learn more about them there, but there's an easier way to donate
Persuadee: What is the easier way?
Persuader: The researchers behind this HIT are gathering up donations so that they can give the money to the charity all at once.
Persuader: The research team will collect all donations and send it to Save the Children.
Persuader: It must save time and transaction fees for the charity that way.
Persuadee: That's interesting and sounds good, right?
Persuader: Yeah, it does sound good.
Persuader: Of course it's your decision, in the end.
Persuader: I am kind of curious about the details though.
Persuader: How much do you like to donate to the charity now?
Persuader: The researchers will let you donate anything up to the amount of your total task payment.
Persuader: Or nothing, if that's what you decide.
Persuadee: I think i will make a donation of $2
Persuadee: That's wonderful!
Persuadee: I think I'm getting eager to see what happens next with the research and the charity, so I'm about to move on.
Persuadee: It was great chatting with you.
Persuadee: And thanks for helping!
Persuader: That's wonderful!
Persuader: I think I'm getting eager to see what happens next with the research and the charity, so I'm about to move on.
Persuader: It was great chatting with you.
Persuader: And thanks for helping!",Yes,No,Yes,No,No,Yes,Yes,No,Yes,Yes,Emotional,Yes,Yes,Yes,Concrete,Yes,No,Yes,Yes,Yes
20180826-180314_928_live,"Persuader: Hi.
Persuader: How are you?
Persuadee: Hello, I'm fine.
Persuadee: How are you?
Persuader: I'm doing well. Thanks.
Persuader: Have you been using MTurk long?
Persuader: I've only just started in the last few days and I love it.
Persuader: It's pretty easy money most of the time.
Persuader: I'm Tommy, by the way.
Persuadee: Hi Tommy I'm Cassidy.
Persuadee: I've been using mTurk on and off for about half a year but the past month I've really commmited to doing tasks everyday.
Persuadee: It's great to earn extra money here and there.
Persuadee: I'm glad you're enjoying it.
Persuader: Well thanks, Cassidy.
Persuader: It definitely seems like a fun way to make some extra money.
Persuader: I feel like sometimes people don't understand how even just a few dollars can make a difference in people's lives.
Persuader: For example, I like to give a little money to charity each month.
Persuader: And you'd be surprised how far even just a little bit of money goes in some impoverished countries.
Persuader: How about you, Cassidy?
Persuader: Do you like giving to charities?
Persuadee: I do enjoy donating to charities.
Persuadee: I don't usually have a ton of extra money so it's not an every month kind of thing for me but I try to give at least once a year.
Persuadee: And when I can't give monetarily donate food, my time, and go to blood drives on my university
Persuader: Aww, that's really considerate of you.
Persuader: I have two sponsored kids myself, one from Ghana and one from Mexico and they send me letters every month.
Persuader: Cassidy, you'd be surprised how emotionally attached I am to them and I have never even met them.
Persuader: I send them 20 dollars on their birthdays and then they send me pics of what they bought.
Persuader: It's really sweet.
Persuader: Then there is another charity I like a lot which allows for really small donations.
Persuader: Have you heard of Save the Children?
Persuadee: No, I haven't heard of Save the Children.
Persuadee: And its awesome that you help out those kids in need
Persuader: The thing is, Cassidy, is that I don't have any of my own right now, so it kind of fills a need, you know?
Persuader: I like Save the Children because they rank towards the top of reputable charities on the ranking sites.
Persuader: The other thing is that they allow for small donations which have a big impact in countries like Syria where the local currency has dropped so considerably.
Persuader: It's really really sad what's going on over there.
Persuader: Anyways, even 50 cents goes a long way you know?
Persuadee: Yeah, 50 cents isn't too bad.
Persuadee: Maybe I'll consider donating to them
Persuader: Well, personally, I've made about 8 dollars already here today, so I'm going to donate the 30 cents from this HIT to them.
Persuader: Did you know that there is an option to do that for this HIT?
Persuadee: No, I didn't know but thank you for telling me!
Persuadee: I think I might donate mine too!
Persuader: I say we do it together!
Persuader: See, Cassidy, no single one of us can fix all the problems in this world.
Persuader: There is too much suffering, too many children growing up in poverty and trauma.
Persuader: But together, if we stick together, if we put our money together, you'd be surprised how much we can change in this world.
Persuader: How many lives we can help.
Persuader: What do you say, Cassidy, do you want to join me today in helping these kids?
Persuadee: Yes I do, you've really inspired me Tommy
Persuader: Great!
Persuader: That's so generous of you.
Persuader: How much would you like to donate to them today?
Persuader: Your donation will be directly deducted from your task payment.
Persuader: You can choose any amount from  zero to the whole .30 cents.
Persuader: Personally, I'm giving them the full amount.
Persuadee: I'l do 20 cents
Persuader: Well thats fantastic of you.
Persuader: I feel like together we made a small difference in the world today.
Persuader: How about you?
Persuadee: I do too
Persuader: Well great.
Persuader: I wish you a happy rest of your weekend.
Persuader: And it was a pleasure chatting with you today.
Persuadee: It was nice chatting with you too",Yes,No,No,Yes,No,Yes,Yes,No,No,Yes,Emotional,No,Yes,Yes,Concrete,Yes,No,Yes,Yes,Yes
20180826-180554_582_live,"Persuader: Good evening how are you doing today?
Persuadee: good thanks.
Persuader: I am writing to ask you to donate 10 dollars to save the children.
Persuader: This organization helps children's rights and supports children living in developing countries
Persuadee: Yes I would
Persuader: Your donation is essential to help ensuring children's rights to health, education, safety, etc. It will make a real difference in the world.
Persuadee: I know it does I'll donate 5 dollars
Persuader: We have many children who starve and die of hunger.
Persuader: You donation will stop this from happening and possible save a child's life
Persuadee: I realize that
Persuader: Save the children have been fight child hunger and disease for many years We have made a big inpact in these children's lives over the many years.
Persuadee: That's is good
Persuader: We have not received much support for these children.
Persuader: For instance, millions of Syrian children have grown up facing the daily threat of violence.
Persuader: In the first two months of 2018 alone, 1,000 children were reportedly killed or injured in intensifying violence.
Persuader: Your donation could possible go to this problem and help many young children
Persuadee: Yes I know I will donate 5 dollars
Persuader: This will help out tremendously!
Persuadee: i know it will
Persuader: If you could please ask you friends and family to help?
Persuadee: I will are you going to help
Persuader: Convince them that they waste too much money on unnecessary stuff like snack and candy.
Persuader: They could be helping people with their money'
Persuadee: yes I know
Persuader: Please look at our website  URL You can find out a lot about Save the children. It shows you all our sucess stories.
Persuadee: yes I have in going to donate
Persuader: Okay great!
Persuader: Thank you so much for your time and donation.
Persuader: We appreciate any help we can get.
Persuader: Remember to pass along our info to friends and family. Thank You and good night!",Yes,No,Yes,Yes,No,Yes,Yes,No,Yes,Yes,Emotional,Yes,Yes,Yes,Concrete,Yes,No,Yes,Yes,Yes
20180826-180631_700_live,"Persuader: hi! how are you today?
Persuadee: Hello!
Persuadee: I am good.
Persuadee: How are you today?
Persuader: I am doing well thank you.
Persuader: Have you heard of save the children?
Persuadee: I haven't.
Persuadee: What is it all about?
Persuader: It is an organization that helps raise money to help the children around the world
Persuadee: I have a passion for children.
Persuadee: That would be a charity I would donate too for sure.
Persuader: It is great.
Persuader: the children are our future and need the chance to have a full life
Persuadee: I do agree 100%  How would I go about finding this charity?
Persuader: they have a website at  URL
Persuadee: Thank you very much.
Persuadee: I will look into it for sure and make a donation.
Persuader: You can also donate after we finish here, too!
Persuadee: That is awesome.
Persuadee: I will definitely be making the donation.
Persuader: that's great!
Persuader: Do you ever volunteer?
Persuadee: I do volunteer some.
Persuadee: I also take in children that would other wise go without.
Persuader: that is amazing!
Persuader: you are an excellent human being
Persuadee: Thank you.
Persuadee: Do  you volunteer any where?
Persuader: I work with chidlren of abuse.
Persuader: it's hard work, but they need help
Persuadee: You are a wonderful person.
Persuadee: Those children need your help.
Persuader: Well it was lovely chatting!
Persuader: how much will you donate today?
Persuadee: I will donate half of my earnings.
Persuadee: It was lovely chatting with you.
Persuadee: Will you be donating?",Yes,No,Yes,No,Yes,Yes,Yes,No,No,Yes,Emotional,Yes,Yes,Yes,Concrete,Yes,Yes,No,Yes,No
20180826-181020_331_live,"Persuader: Hello!
Persuader: How are you today?
Persuadee: Hello
Persuader: What are your thoughts on donating to children's charities?
Persuadee: I would like to donate
Persuader: That is great!
Persuader: Have you ever heard of Save the Children?
Persuadee: Yes before yes
Persuader: If you were given the chance to donate some or all of your incoming payment for this task to Save the Children, would you?
Persuadee: 6 dollars is good
Persuader: Wow!
Persuader: That's a great amount.
Persuader: If the research team in charge of this agreed to send a portion of your payment for this task to Save the Children, would you agree to that?
Persuadee: Because I like children
Persuader: If you got paid 30 cents for this task, How much of that would you be willing to donate?
Persuadee: 30 or more
Persuader: That's awesome!
Persuader: You would be helping some children who desperately need it
Persuadee: Yes those children need
Persuader: Did you know that in the first 2 months of 2018 alone, 1000 kids were killed or injured in the violence happening in Syria?
Persuader: Your donation will help those kids so much.
Persuader: You should feel so good donating
Persuadee: Yes.
Persuadee: I do
Persuader: So at the end of this, you can choose any amount from $0 to all of your payment.
Persuader: What do you think you will be choosing?
Persuadee: I would be
Persuader: So how much of your payment will you be donating?
Persuader: The research team will collect all donations and send it to Save the Children.
Persuadee: Like.
Persuadee: 3 dollars
Persuader: Thank you so much for that",Yes,Yes,No,No,No,Yes,No,No,No,Yes,Emotional,Yes,Yes,Yes,Concrete,Yes,No,No,No,No
20180826-181249_805_live,"Persuader: I was wanting to see if you would be willing to donate to a charity called Save the Children.
Persuader: They promote childrens rights, provide relief and helps support children in developing countries.
Persuadee: maybe
Persuader: So many children die every day due to starvation and acts of violence in these developing countries.
Persuader: These children are not given the same opportunity at education as you and I.
Persuader: Just a small  donation of .50 could help imact a childs life.
Persuadee: that is not bad
Persuader: Think about the unnecessary money that you spend on small things everyday like a snack or bag of candy.
Persuader: Most of these children will never know what it is like to go into a store and purchase something of such luxury.
Persuadee: yeah, that is true.
Persuadee: spend lots of money on beer
Persuader: Most people find they get great satisfaction from helping someone out.
Persuader: You might find that you will eel the same way.
Persuadee: how are the donations made?
Persuader: Your donation will be directly deducted from your task payment.
Persuader: You can choose any amount from $0 to all your payment.
Persuadee: ok.  it only pays $0.30 though
Persuader: It is your choice what you would like to donate so if you want to do .30 you can.
Persuadee: ok that would be fine
Persuader: How much would you like to donate to the charity?
Persuadee: $0.25 is a good amount
Persuader: The research team will collect all donations and send it to Save the Children.
Persuadee: that sounds good
Persuader: Do you feel satisfaction from your generous donation today?
Persuadee: yes, that is fine
Persuader: Thank you very much for you help!
Persuadee: thank you and hope it helps",Yes,No,Yes,No,No,Yes,Yes,No,No,Yes,Emotional,Yes,Yes,Yes,Concrete,Yes,Yes,No,No,Yes
20180826-181742_58_live,"Persuader: hello, are you interested in charities?
Persuadee: yes i am are you?
Persuader: of course i am, do you know save the children charity?
Persuadee: no can you tell me a little about it
Persuader: of course, save the children is a non-profit organization that helps the children all over the world.
Persuadee: that sounds great.
Persuadee: i feel like i need to do something like that
Persuader: are you interested in helpin childrens?
Persuadee: how can i help them?
Persuader: you can help them by donating, do you want to donate?
Persuadee: how long have you been donating for?
Persuader: several years now, different organizations.
Persuader: do you like to donate?
Persuadee: what other organizations?
Persuadee: i donate sometimes.
Persuader: when i see or when they ask me i help, are you willing to donate today?
Persuadee: i need a little more information, if thats not too much to ask?
Persuader: no of course, what you need to know?
Persuadee: what exactly does the charity do for children?
Persuader: they feed them , buy clothes, cure them, and take them to schools.
Persuadee: how much can i donate?
Persuader: every amount is desirable, you heart would know.
Persuadee: is 20 dollars okay?
Persuader: yes of course, are you willing to donate such money?
Persuadee: yes i am",Yes,Yes,No,No,No,Yes,No,No,No,Yes,Emotional,Yes,Yes,Yes,Concrete,Yes,No,No,Yes,Yes
