B2,Combined_Text,Framing,Priming,Repetition,Narrative/Story,Reciprocity,Commitment and Consistency,Social Proof,Scarcity,Authority,Liking,Argument Type,Hedging and Politeness,Pronoun Use,Active Tense,Concreteness,Linguistic Fluency,Linguistic Mirroring,Credibility Markers,Certainty Markers,Rhetorical Questions
20180808-032124_114_live,"Persuader: Have you thought about how much of the reward for this HIT you want to donate to Save the Children?
Persuadee: I do not want to donate any of my reward for this hit.
Persuadee: I make donations to charity regularly but not from jobs that I do.
Persuader: Save the Children is a great international no-governmental organization that promotes children's rights, provides relief and helps support children in developing countries.
Persuader: It has a very low overhead and almost all the money donated to it is directly used to help children.
Persuadee: I know that it is a good organization and I support them.
Persuadee: However I am not getting a reward from this hit.
Persuadee: I am spending my time completing it so I am being paid for a job.
Persuadee: I want the money to do with as I choose.
Persuader: Save the Children has helped build hundreds of schools in developing nations around the world.
Persuader: They've educated many children who have gone on to do important medical and other life saving jobs.
Persuadee: I still do not want to make a donation from this money.
Persuader: Another example is in Syria over 1,000 children have already been killed this year!
Persuader: Save the Children is helping to evacuate as many children as possible from that country.
Persuader: Don't you think every child deserves a long and happy life?
Persuadee: Yes I do think that they do.
Persuader: Don't you want to be part of the solution by giving as much money as possible to Save the Children so they can help as many children as possible?
Persuadee: I do not want to make a donation today.
Persuader: Think about how you were probably going to just waste the measly reward amount you were being offered for this HIT on junk food or coffee and think about what amazing things Save the Children would be able to do with that money.
Persuadee: I am not going to waste the reward.
Persuadee: I use it for things that my family needs.
Persuader: Think about how much more those poor kids in developing countries needs the money.
Persuader: Your family is rich enough to live in a first world country and have food on a daily basis.
Persuader: By not donating this tiny amount you're directly allowing children to sufer.
Persuadee: We work for everything that we have.
Persuadee: Nothing is just given to us soooo I am not going to give away something that I work for unless I want to do so.
Persuader: Of course you work for everything you own.
Persuader: By helping Save the Children you will directly be allowing a child to grow up and work for things him or herself rather than living in poverty and possibly not even making it out of childhood.
Persuadee: It still does not change the fact that I am not going to make a donation with this money.
Persuader: Save the Children will even let you know about the specific child that your money is helping.
Persuader: So you will really get to know that one child.
Persuader: It's not just some faceless organization with faceless non existant children.
Persuader: Everything is completly real and on the up and up.
Persuadee: I understand this and have supported Unbound a similar charity for years.
Persuadee: Since I already donate to a charity like this I am not making a donation.
Persuader: How much do you like to donate to the charity now?
Persuader: Your donation will be directly deducted from your task payment.
Persuader: You can choose any amount from $0 to all your payment.
Persuadee: I will not donate anything $0.",Yes,Yes,Yes,Yes,No,No,No,No,No,No,Emotional,Yes,Yes,Yes,Concrete,Yes,Yes,Yes,Yes,Yes
20180808-032354_369_live,"Persuader: Just found out there are tons of sick kids right now over seas that need help
Persuadee: wow that sounds like a problem
Persuader: It is a huge problem to them but you and I do not have that problem huh?
Persuadee: actually i have a kid that is sick and overseas right now
Persuader: What are you doing to help?
Persuadee: donating money to them
Persuader: You know there is an organization I donate money also too.
Persuadee: tell me more?
Persuader: It is called 'Save the Children'.
Persuader: It is an international organization that promotes children's rights, provides relief and helps support children in developing countries.
Persuadee: do they help kids in africa
Persuader: all developing countries in the world
Persuadee: i notice they didnt send money to my child though, he is sick and overseas?
Persuader: I am sure it will get to your child.
Persuadee: well maybe you could donate to my child.
Persuadee: since you are so into helping out kids
Persuader: It would be best to donate to a specialized organization to allocate the funds in a proper, efficient way so all children can get the maximum benefit from the money.
Persuadee: how do we do that
Persuader: The research team here will collect all donations and send it to the Save the Children.
Persuader: This lump sum will be used to buy mass quantities of supplies at inexpensive prices.
Persuadee: how much will you donate
Persuader: All of it
Persuadee: how much should i give?
Persuader: I would give all you have.
Persuader: It would be easy for you to get it back but for the children, this would be huge",Yes,Yes,No,No,No,Yes,Yes,No,No,Yes,Emotional,Yes,Yes,Yes,Concrete,Yes,No,No,Yes,Yes
20180808-032545_201_live,"Persuader: HI GOOD MORNING
Persuadee: Good morning.
Persuadee: How are you today?
Persuader: FINE,SAVE THE CHILDREN , HOW DO YOU THINK ABOUT THE DONATION THE SAVE THE CHILD.
Persuadee: I don't usually donate to charities.
Persuadee: Is that something that you personally do?
Persuader: NO BUT, ITS A INTERNATIONAL NON-GOVERNMENTAL ORGANIZATION TO THE CHILD
Persuadee: I like the fact that it's an international organization.
Persuadee: What kinds of things do children's charities do?
Persuader: SAVE THE CHILDREN , FOR YOUR CLARIFICATION YOU GO AND CHECK THE  URL WEBSITE.
Persuader: ITS VERY HELPFUL TO THE ORGANIZATION.
Persuadee: I took a look at the website.
Persuadee: So it looks like the money goes toward health and education?
Persuadee: Things like that?
Persuader: YES, SO HOW MUCH DO YOU LIKE TO DONATE TO THE CHARITY NOW?
Persuadee: I'm still not sure.
Persuadee: I worry that my money won't actually go to the children, that it'll just be paying for someone's job at the charity.
Persuader: YOU CAN TRUST OUR  ORGANIZATION, YOU DONATE THE CHILDREN IS VERY HELPFUL TO THEY OF EDUCATION , HEALTH AND SAFETY. ETC.,
Persuadee: Do you know how much of the donation goes to the children?
Persuadee: I heard that, with some organizations, only 10% of the money goes to the recipient!
Persuader: NO, WE CAN PUT 100% TO THE CHILDREN USE ONLY, SO YOU CAN TRUST OUR ORGANIZATION.
Persuadee: That makes me feel much better.
Persuadee: Does your organization provide receipts, for tax purposes?
Persuader: NO TAX AND HOW MUCH DO YOU LIKE TO DONATE TO THE CHARITY NOW?
Persuadee: How does a person go about making a donation?
Persuadee: On the website?
Persuader: URL YOU GO AND DONATE TO THE WEBSITE.
Persuadee: What kind of payments do you take?
Persuadee: Do you take credit cards?
Persuader: YES SURE,
Persuadee: I think that you convinced me.
Persuadee: I'll definitely go and make a donation today.",Yes,No,Yes,No,No,Yes,No,No,No,Yes,Logical,No,Yes,No,Concrete,No,No,No,Yes,No
20180808-033451_555_live,"Persuader: do you like kids
Persuadee: Yes I have 2
Persuader: do you know many kids in the world are suffering
Persuadee: Not exactly, but I'm sure it's thousands
Persuader: Yes exactly right.
Persuader: Save the children is a group that helps kids in warzones
Persuadee: That sounds like a worthwhile cause
Persuader: have you ever donated to a charity
Persuadee: Yes, very often
Persuader: i plan on donating to save the children
Persuadee: I will too.
Persuadee: Also to abused women.
Persuader: me also, do you know how much a candy bar costs
Persuadee: 85 cents to 1.35 around here
Persuader: yes those are the exact prices, should we donate that much?
Persuadee: That sounds perfect
Persuader: do you ever get tired of being awesome?
Persuadee: Nope.
Persuadee: Not even a little!
Persuader: thats cool, it seems hard?
Persuadee: Not really, I just try to be helpful
Persuader: me too, DONT BETRAY MY TRUST
Persuadee: I believe in that",Yes,Yes,No,No,Yes,Yes,Yes,No,No,Yes,Emotional,Yes,Yes,Yes,Concrete,Yes,Yes,No,Yes,Yes
20180808-034352_717_live,"Persuader: Hello!
Persuader: How are you doing today?
Persuadee: I'm great!
Persuadee: How are you?
Persuader: I'm good!
Persuader: Where are you from?
Persuadee: New York, how about yourself?
Persuader: PA!
Persuader: But actually, I'm headed up to Bay Ridge this Saturday!
Persuadee: Nice, I hope it's not too warm this weekend
Persuader: Me too!
Persuader: and that the rain holds out.
Persuader: So, what social issue hits closest to home for you?
Persuadee: I think it's the astronomical costs of healthcare.
Persuadee: Americans pay more for poorer outcomes, compared to peer countries.
Persuader: I couldn't agree more!
Persuader: Healthcare costs are crazy over here.
Persuader: A family pays $500 a month for insurance, but yet blood work is still $200 out of pocket.
Persuader: There are so many relevent issues going on in the world right now its hard to focus on just one.
Persuader: What are your thoughts on charities for children?
Persuadee: I think they are important; and there are several focusing on distinct issues.
Persuadee: It's sometimes hard to focus
Persuader: Have you ever heard of ""Save the Children?""
Persuader: Its a global charity that works to protect children in terms of safety, protect their rights, prevent starvation,get them proper health care and to ensure a proper education for them as well.
Persuader: Over 1,000 children die every 2 months in Syria from starvation and violence.
Persuadee: Yes, I have
Persuader: Would you be willing to donate any of your task payment to this charity today?
Persuader: Any amount over 0$ can be donated, even as little as a few cents and everything helps!
Persuader: The researchers from this study would do all of the work and ensure the donation gets to the charity.
Persuadee: Sure, I will donate 10 cents
Persuader: Thank you so much!
Persuader: That is so kind of you :)
Persuader: Your donation will help make these children's lives better in some way.
Persuader: There are so many issues in this world it is hard to do something about or figure out how to help but this is a step in the right direction.
Persuadee: That;s great!
Persuadee: Thank you for telling me about this charity
Persuader: No problem!
Persuader: There are so many shady charities out there that I think a lot of people are afraid to donate because they do not know where their money is going, but Save the Children is a great and trustworthy one.
Persuadee: I agree!
Persuadee: Good choice
Persuader: I hope you have a great day!
Persuader: Thank you again!
Persuadee: You too!
Persuadee: Have a great week",Yes,No,No,Yes,Yes,Yes,No,No,No,Yes,Emotional,Yes,No,Yes,Concrete,Yes,Yes,Yes,No,No
20180808-034448_815_live,"Persuader: Hi there.
Persuader: Have you ever thought about who the most vulnerable people are when a natural disaster strikes?
Persuader: Or when there's political unrest?
Persuadee: That is something I do not think about.
Persuader: Actually, I'm really troubled by the answer.
Persuader: In countries like Syria, 1000 children have been killed during the civil war.
Persuader: Isn't that insane?
Persuadee: That is terrible.
Persuadee: I wish this wasn't true.
Persuader: Seriously.
Persuader: Adults often can't fend for themselves when there's a crisis, but children are especially vulnerable.
Persuader: Do you think that if you could do something to help Syrian children or children in Indonesia, which just experienced an earthquake, you would?.
Persuadee: That would be something I would do, yes.
Persuader: Yeah, me too.
Persuader: Every day I watch the news and hear about victims all over the world and feel kind of powerless.
Persuadee: You have more power than you realize.
Persuader: Can you elaborate.
Persuader: How do you think people like us could help?
Persuadee: We could either donate money or our time.
Persuader: Absolutely.
Persuader: There are so many charities out there but I\'ve been researching one in particular called ""Save the Children.""
Persuader: All of the money they collect goes straight to helping children in war torn parts of the world and places that have suffered natural disasters.
Persuadee: I will have to take a look at the website.
Persuader: Is there any information that I could provide you with.
Persuader: I really believe in this organization and think it's worthwhile.
Persuadee: How long has the organization been around?
Persuader: It's actually been around since 1919, when it was founded by this woman in London right after World War I
Persuadee: What is the womens name that founded it?
Persuader: I have to be honest with you.
Persuader: I'm going to look that up.
Persuader: Her name is Eglantyne Jebb.
Persuadee: Who runs the organization now?
Persuader: Well, a woman named Carolyn Miles is the CEO.
Persuader: Are you familiar with the organization?
Persuadee: No I am not, but like I said.
Persuadee: I will look at it in the future.
Persuader: I know I haven't given you that much info, but do you think you might want to donate part of your proceeds for this task to Save the Children?
Persuader: It's a great NGO that is really making a difference in developing countries.",Yes,No,No,No,No,Yes,Yes,No,Yes,Yes,Emotional,Yes,Yes,Yes,Concrete,Yes,No,Yes,Yes,Yes
20180808-035431_488_live,"Persuader: Hello, how are you today?
Persuadee: I'm good.
Persuadee: What Children's charity would you like to donate money to?
Persuader: I like to donate, but i have a soft heart for children too.
Persuader: I recently read about ""Save the Children"" and red more about it.
Persuadee: Save the Children sounds like a good charity to me as well.
Persuader: Yes I like how they are clear about their financial reports and They are a big organization
Persuadee: Clear financial reports are a very good thing.
Persuadee: They work with children all around the world.
Persuadee: Correct?
Persuader: Yes they work in 120 different countries, on different issues.
Persuadee: Wow, that's amazing.
Persuadee: Definitely a charity that I could stand behind and support.
Persuader: Same here, they have many option to help, We can donate or We can participate in their events
Persuadee: I don't know much about their events.
Persuadee: But I have money that I can donate.
Persuader: I usually like to help financially too, since I do not have many off days to join event.
Persuader: Some of their members even travel to different countries to help in person.
Persuader: I believe that is a big thing to do
Persuadee: I wouldn't have the time off to do that.
Persuadee: But that's pretty cool what they do.
Persuader: Yes, they are also connected to big companies like IKEA and Walt Disney.
Persuader: I would like to see part of my purchase will be donated
Persuadee: Donating part of a purchase is such an easy way for a large amount of people to donate money.
Persuader: Exactly, I also like how there are HITs which encourage you to donate.
Persuader: It makes me happy to donate part or all of my bonus
Persuadee: If it's a charity I believe in that's a great way.
Persuadee: I donate to many local charities in my city.
Persuader: that is so nice of you.
Persuader: like ""Save the Children"" has many options to donate.
Persuader: You can directly donate through website, It has a minimum amount, but you can also donate part of the HIT reward at the end of the conversation, It can be 0 or 1 cent or any other amount
Persuadee: I think I'll probably donate at the end of this conversation.
Persuadee: Will you be doing so as well?
Persuader: I sure will.
Persuader: I did it in the past.
Persuader: and surprisingly my reward did not even change
Persuadee: I've had similar things happen.
Persuadee: I'm glad we good agree on a charity to donate to.",Yes,Yes,Yes,No,Yes,Yes,Yes,No,Yes,Yes,Emotional,Yes,Yes,Yes,Concrete,Yes,Yes,Yes,Yes,Yes
20180808-035715_390_live,"Persuader: Hello, how are you doing today?
Persuadee: Good thanks!
Persuadee: You?
Persuader: Very well.
Persuader: Do you have any particular hobbies that you enjoy?
Persuadee: Mostly into hiking these days - how about you?
Persuadee: Do you have any info on this children's charity we're supposed to talk about?
Persuader: I like to play golf, as well as go on walks with my dog.
Persuader: Yes, the charity sounds like it does a lot of great work.
Persuadee: Walks with the dog sound awesome.
Persuadee: I wasn't given any information about the charity but am happy to help.
Persuader: Great!
Persuader: I have three children myself, and the welfare of children around the world is a very important cause to me.
Persuader: Save the Children is an international organization that is not involved with any government, and they're able to promote children's rights and support kids in developing countries.
Persuadee: Sounds like great work.
Persuadee: I donate to a lot of different causes but am happy to pitch in.
Persuadee: Are we attempting to agree on a donation amount?
Persuader: That might be a good idea.
Persuader: Just to give some more info, they are a charity you can trust to actually do the work they promise to do.
Persuader: Any donation we give will make an impact around the world.
Persuadee: Very cool, I have heard of them but never looked into them too closely.
Persuadee: Do you already donate to them?
Persuadee: Monthly or one-time?
Persuader: You can do either.
Persuader: I prefer monthly, just so it fits in my budget easier.
Persuadee: Sounds good.
Persuadee: Suggestions on a donation amount?
Persuader: How about some of the payment from this HIT?
Persuader: Any amount from $0 to all of your payment would help.
Persuadee: Sure, I'm happy to donate half the payment for the HIT
Persuader: $1 will help a lot, but $2 would really help them reach kids around the world.
Persuader: I would rather get all of the payment too, but helping kids is better than spending that $1 on a candy bar or other snack instead.
Persuadee: I'll start with $1 and maybe give more later :)
Persuader: That's okay.
Persuader: Just so you're aware, a large part of their work is in war zones such as Syria.
Persuader: In the first two months of 2018, around 1,000 children were killed or injured due to violence there.
Persuader: Save the Children works to provide relief in countries like that.
Persuadee: Yeah I've seen a lot of the news on Syria, it's horrible.
Persuadee: I work with Doctors Without Borders too, glad there are multiple players in the region to help!
Persuader: So $1 is your donation?
Persuader: I'm sure that Save the Children will put it to good use!
Persuadee: Yes, $1 - thank you",Yes,No,No,No,Yes,Yes,Yes,No,No,Yes,Emotional,Yes,Yes,Yes,Concrete,Yes,No,Yes,Yes,No
20180808-040435_931_live,"Persuader: Good Morning!
Persuader: I'm hoping you can help me out to today.
Persuadee: Sure, as long as you can help me out as well... you see, I have a child that is overseas, in a warzone.
Persuadee: they are hungry and injured and also short
Persuader: I'm so sorry, what a terrible thing.
Persuader: Well not being short, that's fine.
Persuadee: yeah, i mean, i guess
Persuader: I am also here to help children in underprivileged areas, by supporting the Save the Children Charity
Persuadee: what is save the children
Persuader: Save the Children promotes rights and provides support for children in serious situations.
Persuader: They work to get food, medical help and education to poor children in under developed countries.
Persuadee: do they help lots of kids
Persuader: Very much so.
Persuadee: do they help kids in africa too
Persuader: They absolutely do.
Persuadee: do they provide medical help too though?
Persuader: That's a very large part of their mission yes.
Persuadee: I see, and it's called Save the Children
Persuader: It is.
Persuader: and they need you help.
Persuadee: Do they help adults?
Persuader: The primary focus is on the children, but of course by supporting children the parents also have some of the vburdens taken off of them.
Persuadee: I see, and do they provide medical help as well?
Persuader: They do.
Persuader: And as I said we definitely need your help.
Persuader: Would you be able to provide some monetary support to this charity and help them Save the Children.
Persuadee: If you can promise me that none of the money will go to help ANY Muslim child, then I will donate two dollars from my payment
Persuader: Unfortunately Save the Children does not discriminate against any suffering child.
Persuadee: then unfortunately, i cannot give any money",Yes,No,No,Yes,No,No,No,No,Yes,Yes,Emotional,Yes,Yes,Yes,Concrete,Yes,No,Yes,No,Yes
20180808-042339_620_live,"Persuader: save the children is a non profit organization helping children around the world
Persuadee: wow that is neat
Persuader: for just a small amount you can help a child starving in Africa, and other children who are homeless
Persuadee: that sounds expensive
Persuader: just a few dollars, while lyou can donate as much as you like, every little bit means a better life for these children
Persuadee: how much do you give
Persuader: 2=3 dollars a month
Persuadee: ok how ill give that much
Persuader: You will be helping to feed hundreds of chldren for just pennies on the dollar
Persuadee: ok great im in
Persuader: how much would you like to donat to the charity now?
Persuadee: about thousand dollars at least
Persuader: as your donation will be directly deducted from you task payment, I would ask that you keep the amount confined to that amount
Persuadee: ok ill give that
Persuader: and how much of that would you like to donate to the charity right now
Persuadee: oh at least a thousand
Persuader: well if your making that much off one hit on mechanical turk, I need to switch professions
Persuadee: yes, in fact ill most likely give ten thousand
Persuader: Your donation would make a real impact on many children, who have no acess to medical care, clothing, or education
Persuadee: oh thats good",Yes,No,Yes,No,No,Yes,No,No,No,Yes,Emotional,Yes,Yes,Yes,Concrete,Yes,Yes,No,Yes,No
20180808-043445_804_live,"Persuader: Hello, how are you today?
Persuadee: Hi, I'm doing OK, how are you?
Persuader: I am fine thanks.
Persuader: Are you interested in donating?
Persuadee: Possibly, I'm not sure.
Persuadee: I don't even know what the charity is.
Persuader: The organization which collects money from people, and spend it on people and issues which are needed
Persuadee: Right, but I would like to know specifically what organization.
Persuader: I myself have a soft heart for children and usually help the charities for children.
Persuader: Have you heard of ""Save the Children""?
Persuadee: Yes.
Persuadee: Are you planning to donate?
Persuader: I am planning to donate.
Persuader: I heard about this organization few weeks ego on MTurk, and i too k the time to read about it.
Persuader: It took my attention and I donated on the last HITs i did
Persuadee: OK.
Persuadee: I only like to donate to reputable organizations, I am familiar with save the children, they often advertise.
Persuader: Yes , they are connected to big companies.
Persuader: They work in 120 countries on different issues.
Persuader: I am careful when I want to donate too
Persuadee: I'm not sure how this donation process will work, do you know the specifics?
Persuadee: I always like to know how the donations are spent.
Persuader: same here, this organization publishes brief financial reports on its website.
Persuader: I've checked on this link:  URL s/about-us/financial-information
Persuadee: thanks.
Persuadee: i wonder what a reasonable donation amount would be.
Persuader: on the website there is a minimum amount but through HIT you can donate anything even 1 cent.
Persuader: I donated before and surprisingly it did not even hurt my reward.
Persuader: I thought it will
Persuadee: Great.
Persuadee: Then I will do it.
Persuadee: I usually donate to animal charities.
Persuader: I love animals.
Persuader: MTurk introduced me some good charities.
Persuader: I donated 50 cents each time to ""Save the Children""
Persuadee: Good to know.
Persuadee: Thanks for the info, guess I am skeptical.
Persuader: I would be too, It is not easy to trust these days
Persuadee: It's good to be able to help someone else out and have it be easy and painless.
Persuader: Thanks for your time and effort.
Persuader: It was a nice chat.
Persuader: Have a nice day
Persuadee: thanks, same to you.",No,No,No,No,No,Yes,Yes,No,Yes,Yes,Logical,Yes,Yes,Yes,Concrete,Yes,No,Yes,Yes,No
