B2,Combined_Text,Framing,Priming,Repetition,Narrative/Story,Reciprocity,Commitment and Consistency,Social Proof,Scarcity,Authority,Liking,Argument Type,Hedging and Politeness,Pronoun Use,Active Tense,Concreteness,Linguistic Fluency,Linguistic Mirroring,Credibility Markers,Certainty Markers,Rhetorical Questions
20180825-073813_141_live,"Persuader: Have you ever heard of ""Save the Children""?
Persuader: It an agency that helps children in underdeveloped and developing countries.
Persuadee: No, I actually haven't .
Persuadee: Do you have any more information about the organization that you could tell me?
Persuader: it is not sponsored or supported by any governmental agencies and it helps children abroad and within the US.
Persuader: You would be shocked at how many children live in poverty here in the United States.
Persuadee: I have an idea.
Persuadee: Whats a more specific idea of what you do?
Persuadee: How do you help?
Persuadee: Whats their overall goal?
Persuader: Well, a very specific goal right is to help the children that are separated from their parents due to our current immigration problem.
Persuader: Can you imagine someone taking your small child away from you and not knowing where they are going, who is going to be caring for them, or if you will ever be able to see them again?
Persuader: As a mother, that thought is horrifying.
Persuadee: It is horrifying, I could not even imagine.
Persuadee: What do you need me to do?
Persuader: Save the Children has committed to providing some of the care and needs for these children until they can be reunited with their parents.
Persuader: Would you be willing to donate your pay for this task to Save the Children so they can continue to provide care for these misplaced children?
Persuadee: My pay?
Persuadee: As in my weekly paycheck?
Persuadee: Or are there any other payment options, as I have bills to pay.
Persuader: No, but you could donate part of your pay for this particular task here.
Persuader: Say, maybe half of your payment for this task or even the whole thing?
Persuadee: I will happily donate my whole payment for this task. :)
Persuader: Thank you!
Persuader: Save the Children is a very reputable charity and your donation will mean so much!
Persuadee: I am so grateful there is a way for me to help financially!!!
Persuader: It really is a great charity and has been around for over 100 years!
Persuader: And while the current immigration crisis is a relatively new problem, they stand ready to help in whatever capacity they can.
Persuadee: That is fantastic to hear!!
Persuader: It has been a pleasure chatting with you and donating your task pay to this fine cause should get you some good Karma for the remainder of your day!!
Persuadee: Thank you!
Persuadee: You will as well for all the hard work you're putting towards this magnificent charity.
Persuader: You are quite welcome!!
Persuadee: You can send me the information with the email you have on file for me. :)
Persuader: ok, I will get it out to as soon as possible!
Persuadee: Thank you so much for your time and the effort you are putting towards this very reputable charity!!",Yes,Yes,No,Yes,No,Yes,Yes,No,Yes,Yes,Emotional,Yes,Yes,No,Concrete,Yes,Yes,Yes,Yes,Yes
20180825-074318_984_live,"Persuader: Good morning.
Persuadee: Good morning, I think children are so important and charities that involve them are needed and we should participate our money or our time.
Persuader: I agree.
Persuader: I would like to tell you about the organization Save the Children.
Persuader: They promote children's rights and help support children in developing countries.
Persuadee: Oh that's wonderful, what a great organization.
Persuadee: Where can I read more about this organization and possible give a donate?
Persuader: You could look at their website URL to get more information.
Persuader: You can make a donation directly from your payment from this task.
Persuadee: Ok, I will consider doing that.
Persuadee: What a great idea!
Persuadee: I would like to read a little about the charity before donating.
Persuadee: How would I donate directly from this task?
Persuader: The research team will collect the donations and send it to save the Children.
Persuadee: I would like to donate 10 cents from this task to Save the Children please.
Persuader: Ok, so that 10 cents will come out of your payment and you will keep the rest of the task payment
Persuadee: Yes, thank you.
Persuadee: I am poor and I can relate to the children who are also poor.
Persuadee: I really need the money that i'm earning for this task, so I feel like giving 10 cents to this charity is fair.
Persuadee: Do you agree?
Persuader: I feel that this is very generous of you.
Persuader: Thank you for agreeing to make a donation.
Persuadee: Your welcome, it is a good feeling to help others in need.
Persuadee: I appreciate you telling me about this organization and directing me to their website.
Persuader: I am glad to share this iinformation.
Persuader: I feel that it is an important organization.
Persuadee: Yes it is.
Persuadee: I always wanted children of my own and could never conceive a child.
Persuadee: So I have much empathy for these children and their needs.
Persuadee: I will tell friends and family to visit the charities website also.
Persuader: That is very kind of you to spread the word about this charity.
Persuader: Thank you for all that you are doing.
Persuadee: How many years has Save The Children been doing charity work?
Persuader: This organization has been around for a long time.
Persuader: I am not sure they exact number of years
Persuadee: That's good.
Persuadee: These days there are tons of people asking for donations for fake charities, it's sad.
Persuader: Yes it is, but this is a good organizations and I really appreciate your donation
Persuadee: I want to thank you again for bringing awareness to this important charity.
Persuadee: In America food is plentiful and we sometimes have to stop and reflect, that other countries aren't as fortunate as we are!",Yes,No,No,No,No,Yes,No,No,No,Yes,Emotional,Yes,Yes,Yes,Concrete,Yes,Yes,No,Yes,Yes
20180825-075451_984_live,"Persuader: Have you ever considered donating to Save the Children?
Persuadee: helping children without parents is the most altruistic thing we can do
Persuader: They can't do it without help.
Persuader: They promote children's rights and provide much needed relief.
Persuadee: in my church we help people no matter their age, but children are special for us
Persuader: The donation would be 100% tax deductible too
Persuadee: That's right, how do you help children?
Persuader: Nearly 5.6 million children die each year due to preventable causes.
Persuader: I help by giving money to them so that doesn't happen so often.
Persuadee: in one occasion trip to Latin America and there the situation is very sad, many children live in the street without anyone
Persuader: There are many different ways to help.
Persuader: You can make a one time donation, become a monthly donor, sponsor a child or even shop their catalog.
Persuadee: On what foundation can I sponsor?
Persuader: The organization is called Save the Children.
Persuadee: This is,  URL  ??
Persuader: Yes, but you can make a donation here today.
Persuadee: yes, I will do it
Persuader: You just have to let me know how much.
Persuader: You can choose any amount from your payment.
Persuader: If you donate 50 cents, I will match that 50 cents as well.
Persuadee: What is my payment?
Persuadee: I want to donate everything
Persuader: I believe your bonus is $1.70
Persuadee: you make me feel sad :( it hurts me to see the picture of the children, I want to donate everything
Persuader: I know it is sad, but be happy there is such a great organization that is trying to help and that you are making a difference
Persuadee: That's right, thanks for showing me the page, I will help many children, today I want to sponsor 3
Persuader: How much do you want to donate on the chat today?",Yes,Yes,Yes,Yes,Yes,Yes,Yes,No,No,Yes,Emotional,Yes,Yes,Yes,Concrete,Yes,Yes,No,Yes,Yes
20180825-075611_866_live,"Persuader: Hello how are you this morning.
Persuadee: I'm good, and you?
Persuader: I'm very well, thank you.
Persuader: Well the reason I'm contacting you is because I'm trying to find donors for the Save the Children foundation.
Persuader: Your donation will help ensure children's rights to health, education and safety.
Persuader: Your donation can help children in need reach their full potential and what's really more important that our children as they are our future.
Persuadee: How much money are you looking for?
Persuader: Any amount of donation would help in this cause.
Persuader: It's surprising how little can make an impact on these kids.
Persuader: The amount of donation is completely up to you
Persuadee: How much of my donation goes to the kids
Persuader: Everything you donate will go to the save the children foundation.
Persuadee: What kind of supplies does my donation provide
Persuader: The supplies vary based on need.
Persuader: Right now they are funding medical and school supplies for kids.
Persuader: As well as preparing a fund to help with whatever damage comes from the hurricane that is bearing down on Hawaii right now.
Persuadee: So if this just for children in America?
Persuader: No, they do help children all over the world.
Persuader: Such as children in Syria who have lost everything from parents to homes due to the conflict they are experiencing, children in Africa who have been orphaned and just need care,
Persuadee: Id like to make a donation, how do I do that
Persuader: You can choose to donate your some or all of your payout from this task.
Persuader: The agreement will be recorded from this chat and deducted from your account.
Persuadee: What if i'd like to donate more
Persuader: You can always donate more at  URL
Persuadee: I think I'd like to donate 0.05
Persuader: Ok I understand that you would like to donate .05 of your payout to save the children.
Persuader: Thank you so much as every little counts and I appreciate your donation
Persuadee: You're welcome, is there anything else that I can do to help
Persuader: Nope that would be all for today.
Persuader: Thank you for supporting the children of the world.
Persuadee: Great.
Persuadee: Thanks for the oppertunity.",Yes,No,Yes,Yes,No,Yes,No,No,No,Yes,Emotional,Yes,Yes,Yes,Concrete,Yes,No,No,Yes,No
20180825-075627_48_live,"Persuader: Hello, hope your great today.
Persuader: Have you heard of save the children.
Persuader: Hold ten?
Persuadee: I'm doing well, thanks!
Persuadee: Likewise to you.
Persuadee: I have not heard of that charity.
Persuader: Save the children do amazing work with kind kids
Persuadee: How long has this charity been in existence?
Persuader: They have been providing great services for kids for over 10 years
Persuadee: How are they rated as a charity?
Persuadee: Do you have access to their overhead and admin costs breakdown vs. what they actually spend on programs?
Persuader: if you go to save the children.com you can find all of that information
Persuadee: Ah..
Persuadee: I see, you misspelled the charity at the beginning.
Persuadee: I was wondering why you were talking about ""save the hold ten"" vs. ""save the children.""
Persuader: Sorry, typo!!
Persuader: If you would like to donate, it can come right out if your task money today
Persuadee: As I recall, for save the children, they were given a bad reputation back in the '90s due to their excessive spending on administration costs vs. program expenditures.
Persuadee: It was quite the scandal and they became a watchword for bad charities.
Persuader: I believe they have gotten better the last few years!
Persuader: Would you like to donate
Persuadee: No, there are other charities that do a much better job in my opinion that I already donate to, such as Compassion International and World Vision for international children's relief, and my local food shelter.
Persuadee: I can participate directly through volunteer hours and I can also actually visit the children that I help through my family's donations.
Persuadee: That's a big plus for me.
Persuader: Are you sure, you can do as little as 5 cents???
Persuadee: Amounts don't matter to me.
Persuadee: Ethical charities do.
Persuadee: I'm sorry, but I contributed to save the children back in the day before the scandal broke.
Persuadee: I'm afraid for me, their reputation is still bad.
Persuadee: Sorry, no.
Persuader: URL Is there website!
Persuader: You can check them out
Persuadee: Actually, their own website may be a biased barometer of their giving.
Persuadee: Perhaps a link to an organization or other agency that rates major charities would be more helpful.
Persuader: Ok, I disagree with you but see your point
Persuadee: Believe me, if it were any charity besides ""save the children,"" you could have me donate my entire compensation, which isn\'t really all that much.
Persuader: Ok, thank you for your time!!!
Persuadee: Thank you ""PERSON_1""",Yes,No,No,No,No,No,No,No,No,Yes,Emotional,Yes,Yes,Yes,Concrete,Yes,Yes,No,No,No
20180825-075630_493_live,"Persuader: Hi!
Persuader: How are you doing today?
Persuadee: I'm doing well.
Persuadee: How about you?
Persuader: I am great, just enjoying some coffee on my deck.
Persuader: How is the weather for you?
Persuadee: It's cloudy a lot, but otherwise fine.
Persuadee: I was just looking through the morning mail.
Persuadee: A request by a children's charity for a donation.
Persuader: Which charity was the flyer from?
Persuader: The charity I always donate to is called Save The Children.
Persuader: They do wonders for under privileged kids.
Persuadee: I think it was from Save The Children.
Persuadee: So you think they do some actual good?
Persuader: They do for sure.
Persuader: They feed so Many starving kids and are quick to respond to any crisis.
Persuadee: That's encouraging.
Persuadee: Do you usually donate?
Persuadee: They're asking for $50, I was thinking more like $20.
Persuader: I do donate regularly to them.
Persuader: In fact if you are wanting to donate you can donate a portion of your payment from this directly to Save The Children.
Persuader: Is that something you would be willing to do?
Persuadee: That's a thought.
Persuadee: I guess I could do that.
Persuadee: Maybe 1/2 of the payment.
Persuader: That is wonderful!
Persuader: So you are willing to donate half of your payment?
Persuader: I will also donate mine.
Persuadee: Okay.
Persuadee: Let's do that then.
Persuader: Great!
Persuader: These donations will be able to help so many children!
Persuadee: That's the goal, for sure.
Persuader: It absolutely is!
Persuader: I just want to thank you for helping out this great charity.
Persuadee: Glad to help.
Persuadee: I have a needy child of my own, and know how desperate that can make you feel.
Persuader: Absolutely!
Persuader: I hope you enjoy your day, and if you would like to learn more about this charity, you can visit their website.
Persuadee: I may do that.
Persuadee: Enjoy your day also.
Persuader: Thank you!
Persuadee: You are welcome.",Yes,No,Yes,No,Yes,Yes,Yes,No,No,Yes,Emotional,Yes,Yes,Yes,Concrete,Yes,Yes,No,Yes,No
20180825-075647_663_live,"Persuader: Hello there!
Persuadee: can you donate
Persuader: I can and am planning on donating.
Persuader: It seems like a great cause.
Persuader: Do you plan on donating too?
Persuadee: i might donate as well
Persuader: I think it would be great if we both did
Persuadee: it would be great
Persuader: I know if my child was in need I would hope people like us would make a donation - no matter how small.
Persuadee: this is really true
Persuader: What motivates you to donate?
Persuadee: the children do
Persuader: Yes it is truly up to us to help the millions of children in Syria who have grown up only knowing violence
Persuadee: i know its terrible right
Persuader: Yes.
Persuader: How much do you spend on small unnecessary items like coffee or snacks each day?
Persuadee: maybe like 15
Persuader: Wow.
Persuader: Imagine how helpful even a small fraction of that money would be to these kids
Persuadee: yep it will be great for those kids to help them with things they need
Persuader: So how much do you think you'd like to donate?
Persuader: The money will come right from your task payment.
Persuadee: maybe 5 dollars
Persuader: Wow that is very generous of you
Persuadee: yeah i know
Persuader: So you can confirm you'd like to donate $5?
Persuadee: yes i do",Yes,No,No,Yes,No,Yes,No,No,No,Yes,Emotional,No,Yes,Yes,Concrete,Yes,Yes,No,No,Yes
20180825-075658_709_live,"Persuader: Hi!
Persuader: How are you doing today?
Persuader: Would you be interested today in making a donation to a charity?
Persuadee: Which charity would that be?
Persuader: The charity we're taking donations for is save the children!
Persuadee: I've seen a lot of commercials about them, but never did a lot of research about them.
Persuader: They are actually really great.
Persuader: They provide help to children all across the globe and stand up for children's rights.
Persuadee: I know some charities only give a small percentage of donations to children and the rest go to their employees wages.
Persuadee: Do they?
Persuader: I thought that too at first, but luckily save the children is a non-governmental charity, so no one is sticking their hands into the pot.
Persuadee: Thats good, I see they are ready to help out with the hurricane in Hawaii for the kids.
Persuader: Yes!
Persuader: You have to think about how helpless children can be.
Persuader: Every penny can make a huge difference even if it doesn't feel like it.
Persuadee: Do you regularly try to help the organization yourself?
Persuader: I don't personally work for save the children, but I myself have donated several times to the charity.
Persuader: I feel confident that my money goes to the right places.
Persuadee: Yes, I like to help whenever I can when it comes to children.
Persuadee: They are helpless.
Persuader: That's great!
Persuader: So do you think you'd be willing to make a donation?
Persuadee: Do you make donations on line or mail it in?
Persuader: You can actually donate directly
Persuadee: Where, on their website?
Persuader: I'm sorry my last message was cut off.
Persuader: You can actually make a donation directly from this task!
Persuadee: Ok, I would like to.
Persuadee: Maybe ten dollars I can do.
Persuader: That would be an incredible donation that could really go a super long way for save the children!
Persuadee: Ok, I will definitely help out.
Persuader: Thank you so much for your generosity.
Persuader: On behalf of Save The Children, THANK YOU!
Persuader: you should be prompted on a following screen to donate and you can enter your donation there :) Have a great day!
Persuader: Have a great day!",Yes,No,Yes,No,No,Yes,No,No,No,Yes,Emotional,Yes,Yes,Yes,Concrete,Yes,Yes,No,Yes,Yes
20180825-075844_569_live,"Persuader: Have you ever heard of the charity children?
Persuadee: I don't think so, what do they support?
Persuader: I'm sorry.
Persuader: It's save the children.
Persuader: My fingers don't type very well.
Persuader: It's an international nongovernmental organization.
Persuader: They are looking out for children's rights in developing countries
Persuadee: Oh, yes.
Persuadee: I do know save the children.
Persuadee: They are a great organization.
Persuader: That's great news, you know they are untrustworthy.
Persuader: Have you ever donated to them?
Persuadee: I haven't donated to them, which is good apparently.
Persuadee: What makes them untrustworthy?
Persuader: Oh my goodness I meant to say trustworthy.
Persuadee: ha, that is much better.
Persuadee: I don't have a lot of income to donate to charity :(
Persuader: I don't either, and when I do I usually donate to dog charities.
Persuader: LOL but after reading up on this they said every penny helps.
Persuader: I think I could spare .25.
Persuader: Do you want to kick in a little?
Persuadee: I donate to a dog charity also!
Persuadee: such sweet creatures.
Persuadee: I have a dachsund/pit mix named Tuttle.
Persuadee: I can spare a quarter if it helps.
Persuader: That's why we don't have extra money.
Persuader: LOL I have a Labrador who eats everything and this shepherd beagle mix.
Persuader: They are my children .
Persuader: But I guess once in a while we should donate to real children LOL .
Persuader: Okay cool I'll donate 1/4 and you donate 1/4 and then we've done our good deed for the day!!!!
Persuadee: Sounds good to me.
Persuadee: We could donate our earnings from this hit and still make a nickel for kibble.
Persuader: Lmao!
Persuader: Deal!!!
Persuader: Have a great day from Illinois!
Persuadee: Thanks, warmest regards from Alabama
Persuader: I guess we have to each have 10 turns so after this response we have to write two more times LOL
Persuadee: I was wondering that.
Persuadee: Are you a cubs fan?
Persuader: Not really but I've been to one of their games.
Persuader: It was fun.
Persuader: Are you?
Persuadee: I don't really have a team, but I like baseball.
Persuadee: What are your dogs names?
Persuader: Clementine and Eddybear.
Persuader: And they are tired of me messing around on the computer so after the survey we are going to go for a walk!!
Persuader: I think we took ten turns!
Persuadee: Enjoy they walk, I hope it isn't too hot like here.
Persuadee: we have to walk early and late.
Persuadee: It's really hot here too.
Persuadee: Okay I'll put it in my quarter if you put in yours and have an awesome day!
Persuader: It's really hot here too.
Persuader: Okay I'll put it in my quarter if you put in yours and have an awesome day!!",No,No,Yes,No,Yes,Yes,No,No,No,Yes,Emotional,Yes,Yes,Yes,Concrete,Yes,No,No,No,No
20180825-075913_208_live,"Persuader: Would you be interested in donating to Save the Children ?
Persuadee: I am one who like to donate.
Persuadee: Can you tell me more about it?
Persuader: Save the Children helps to promote childrens rights to health, education, and safety.
Persuadee: Do they have any focus right now?
Persuadee: More as where are the majority of the fund headed towards right now/
Persuader: At this point a lot of the focus is children in war zones.
Persuader: some of these donations can address the problem of the daily threat of violence
Persuadee: It seems like Syria seems to be a high stakes area.
Persuadee: Are any fund going to help the the children in Hawaii after the volcano and hurricane?
Persuader: I'm not sure, but I think that would be a great idea.
Persuader: Maybe you could get more information on that by getting in contact with someone at  URL
Persuadee: What are some of the things that they do for the children?
Persuadee: I would like to donate but I am not a huge fan or donating just for promotion?
Persuader: They help to provide basic health care, provide disaster relief, and help to ensure their rights to education and safety.
Persuader: How much would you like to donate ?
Persuader: Your donation will be deducted from your task payment.
Persuadee: I am interested in donating most of my task payment.
Persuadee: How would I go about this?
Persuader: I do believe you have to go to  URL
Persuadee: Would 60% of the task payment be enough?
Persuadee: I know its not much.
Persuader: Yes, that sounds good.
Persuader: How much would that be ?
Persuadee: I think it would be roughly $1.20.
Persuadee: Is there a follow up on to see how my money while little is may be is being put to use?
Persuader: I do believe you can get that information from their website.
Persuader: Thank you so much for taking the time to speak with me and also for your donation.
Persuader: Take care and have a great day.
Persuader: This charity seems to have children's best interests at heart.
Persuadee: I am very happy to help
Persuader: Yes it does.
Persuader: Now, how do we submit this hit ?
Persuadee: We still have chat a bit more.
Persuadee: Have you heard any break thought about this charity?
Persuadee: I am really interested.
Persuader: You were asking about the hurricane relief in Hawaii.
Persuader: From what I understand, they are on stand-by and ready to provide help if needed.
Persuader: I think that is awesome.
Persuader: I had no idea they operated in the USA also.
Persuader: I always thought these organizations focused on other countries
Persuadee: That is very awesome.
Persuadee: I am proud to be apart of helping them help others
Persuadee: I also found out that 86% of donations goes to services and only 5% goes to management.
Persuadee: I was glad to hear that.
Persuadee: It was nice chatting with you.
Persuadee: I enjoyed this.
Persuadee: You take care and have a good day.",Yes,Yes,No,No,No,Yes,Yes,No,No,Yes,Logical,Yes,Yes,Yes,Concrete,Yes,No,Yes,No,No
